{
  "format": 1,
  "id": "gem_line",
  "title": "A gem on every cell",
  "brief": "Put one gem on every cell of the corridor, the last one included. The starter code almost works: run it and see which cell it misses. Corridors come in different lengths.",
  "starter_code": "while front_is_clear():\n    put()\n    move()\n",
  "world": {
    "width": 6,
    "height": 1,
    "start": [
      0,
      0,
      "E"
    ],
    "bag": "infinite",
    "goal": {
      "gems_exactly": {
        "0,0": 1,
        "1,0": 1,
        "2,0": 1,
        "3,0": 1,
        "4,0": 1,
        "5,0": 1
      }
    }
  },
  "hidden_worlds": [
    {
      "width": 1,
      "height": 1,
      "start": [
        0,
        0,
        "E"
      ],
      "bag": "infinite",
      "name": "one cell",
      "goal": {
        "gems_exactly": {
          "0,0": 1
        }
      }
    },
    {
      "width": 2,
      "height": 1,
      "start": [
        0,
        0,
        "E"
      ],
      "bag": "infinite",
      "name": "two cells",
      "goal": {
        "gems_exactly": {
          "0,0": 1,
          "1,0": 1
        }
      }
    },
    {
      "width": 11,
      "height": 1,
      "start": [
        0,
        0,
        "E"
      ],
      "bag": "infinite",
      "name": "long corridor",
      "goal": {
        "gems_exactly": {
          "0,0": 1,
          "1,0": 1,
          "2,0": 1,
          "3,0": 1,
          "4,0": 1,
          "5,0": 1,
          "6,0": 1,
          "7,0": 1,
          "8,0": 1,
          "9,0": 1,
          "10,0": 1
        }
      }
    }
  ],
  "goal": {
    "no_error": true
  },
  "constraints": {
    "hidden_commands": [
      "scan"
    ]
  },
  "topics": [
    "loop_patterns.fencepost",
    "while_loops.infinite_and_off_by_one"
  ]
}
