{
  "format": 1,
  "id": "two_kinds",
  "title": "Trees and hedges",
  "brief": "Plant tree, hedge, tree, hedge, tree, hedge, with an empty cell after each: a tree is two gems tall, a hedge two wide. Finish at the gate (the east end), facing east. Write plant_tree() and plant_hedge() and call them from a for loop. Bonus: 25 lines or fewer.",
  "starter_code": "",
  "world": {
    "width": 16,
    "height": 3,
    "start": [
      0,
      2,
      "E"
    ],
    "bag": "infinite"
  },
  "goal": {
    "no_error": true,
    "gems_exactly": {
      "0,1": 1,
      "0,2": 1,
      "2,2": 1,
      "3,2": 1,
      "5,1": 1,
      "5,2": 1,
      "7,2": 1,
      "8,2": 1,
      "10,1": 1,
      "10,2": 1,
      "12,2": 1,
      "13,2": 1
    },
    "end_at": [
      15,
      2
    ],
    "facing": "E"
  },
  "constraints": {
    "loop_calls": [
      "plant_tree",
      "plant_hedge"
    ],
    "max_lines": 25,
    "hidden_commands": [
      "scan"
    ]
  },
  "topics": [
    "decomposition.top_down_design",
    "decomposition.extract_repeated_code"
  ]
}
