{
  "format": 1,
  "id": "stairs_up_and_down",
  "title": "Up and over",
  "brief": "Climb the staircase, cross the top and go down the other side to the far wall, picking up the gem on every step. Staircases differ in height, and some have a wide top. Finish right_is_clear() with return, and use it.",
  "starter_code": "def turn_right():\n    turn_left()\n    turn_left()\n    turn_left()\n\n\ndef right_is_clear():\n    # turn right, look, turn back, and return what you saw\n    pass\n",
  "world": {
    "width": 8,
    "height": 5,
    "start": [
      0,
      4,
      "E"
    ],
    "blocked": [
      [
        2,
        4
      ],
      [
        3,
        3
      ],
      [
        3,
        4
      ],
      [
        4,
        2
      ],
      [
        4,
        3
      ],
      [
        4,
        4
      ],
      [
        5,
        2
      ],
      [
        5,
        3
      ],
      [
        5,
        4
      ],
      [
        6,
        3
      ],
      [
        6,
        4
      ],
      [
        7,
        4
      ]
    ],
    "gems": {
      "2,3": 1,
      "3,2": 1,
      "4,1": 1,
      "5,1": 1,
      "6,2": 1,
      "7,3": 1
    }
  },
  "hidden_worlds": [
    {
      "width": 7,
      "height": 4,
      "start": [
        0,
        3,
        "E"
      ],
      "blocked": [
        [
          1,
          3
        ],
        [
          2,
          2
        ],
        [
          2,
          3
        ],
        [
          3,
          2
        ],
        [
          3,
          3
        ],
        [
          4,
          2
        ],
        [
          4,
          3
        ],
        [
          5,
          2
        ],
        [
          5,
          3
        ],
        [
          6,
          3
        ]
      ],
      "gems": {
        "1,2": 1,
        "2,1": 1,
        "3,1": 1,
        "4,1": 1,
        "5,1": 1,
        "6,2": 1
      },
      "name": "low and wide"
    },
    {
      "width": 8,
      "height": 6,
      "start": [
        0,
        5,
        "E"
      ],
      "blocked": [
        [
          1,
          5
        ],
        [
          2,
          4
        ],
        [
          2,
          5
        ],
        [
          3,
          3
        ],
        [
          3,
          4
        ],
        [
          3,
          5
        ],
        [
          4,
          2
        ],
        [
          4,
          3
        ],
        [
          4,
          4
        ],
        [
          4,
          5
        ],
        [
          5,
          3
        ],
        [
          5,
          4
        ],
        [
          5,
          5
        ],
        [
          6,
          4
        ],
        [
          6,
          5
        ],
        [
          7,
          5
        ]
      ],
      "gems": {
        "1,4": 1,
        "2,3": 1,
        "3,2": 1,
        "4,1": 1,
        "5,2": 1,
        "6,3": 1,
        "7,4": 1
      },
      "name": "tall and pointed"
    },
    {
      "width": 9,
      "height": 4,
      "start": [
        0,
        3,
        "E"
      ],
      "blocked": [
        [
          4,
          3
        ],
        [
          5,
          2
        ],
        [
          5,
          3
        ],
        [
          6,
          2
        ],
        [
          6,
          3
        ],
        [
          7,
          2
        ],
        [
          7,
          3
        ],
        [
          8,
          3
        ]
      ],
      "gems": {
        "4,2": 1,
        "5,1": 1,
        "6,1": 1,
        "7,1": 1,
        "8,2": 1
      },
      "name": "long walk, wide top"
    },
    {
      "width": 4,
      "height": 4,
      "start": [
        0,
        3,
        "E"
      ],
      "blocked": [
        [
          1,
          3
        ],
        [
          2,
          2
        ],
        [
          2,
          3
        ],
        [
          3,
          3
        ]
      ],
      "gems": {
        "1,2": 1,
        "2,1": 1,
        "3,2": 1
      },
      "name": "no walk-up"
    },
    {
      "width": 13,
      "height": 7,
      "start": [
        0,
        6,
        "E"
      ],
      "blocked": [
        [
          3,
          6
        ],
        [
          4,
          5
        ],
        [
          4,
          6
        ],
        [
          5,
          4
        ],
        [
          5,
          5
        ],
        [
          5,
          6
        ],
        [
          6,
          3
        ],
        [
          6,
          4
        ],
        [
          6,
          5
        ],
        [
          6,
          6
        ],
        [
          7,
          2
        ],
        [
          7,
          3
        ],
        [
          7,
          4
        ],
        [
          7,
          5
        ],
        [
          7,
          6
        ],
        [
          8,
          2
        ],
        [
          8,
          3
        ],
        [
          8,
          4
        ],
        [
          8,
          5
        ],
        [
          8,
          6
        ],
        [
          9,
          3
        ],
        [
          9,
          4
        ],
        [
          9,
          5
        ],
        [
          9,
          6
        ],
        [
          10,
          4
        ],
        [
          10,
          5
        ],
        [
          10,
          6
        ],
        [
          11,
          5
        ],
        [
          11,
          6
        ],
        [
          12,
          6
        ]
      ],
      "gems": {
        "3,5": 1,
        "4,4": 1,
        "5,3": 1,
        "6,2": 1,
        "7,1": 1,
        "8,1": 1,
        "9,2": 1,
        "10,3": 1,
        "11,4": 1,
        "12,5": 1
      },
      "name": "very tall"
    }
  ],
  "goal": {
    "all_gems_collected": true
  },
  "constraints": {
    "hidden_commands": [
      "scan"
    ],
    "required": [
      "return"
    ],
    "use_functions": [
      "right_is_clear"
    ]
  },
  "topics": [
    "return_values.boolean_functions",
    "while_loops.loop_until_condition",
    "decomposition.top_down_design"
  ]
}
