{
  "format": 1,
  "id": "big_piles_only",
  "title": "Big piles only",
  "brief": "Collect every pile of 3 gems or more. Leave piles of 1 or 2 exactly as they are. Pile sizes and corridor lengths change from world to world.",
  "starter_code": "while front_is_clear():\n    move()\n",
  "world": {
    "width": 8,
    "height": 1,
    "start": [
      0,
      0,
      "E"
    ],
    "gems": {
      "0,0": 4,
      "1,0": 3,
      "2,0": 1,
      "4,0": 2,
      "5,0": 5,
      "7,0": 3
    },
    "goal": {
      "gems_exactly": {
        "2,0": 1,
        "4,0": 2
      }
    }
  },
  "hidden_worlds": [
    {
      "width": 4,
      "height": 1,
      "start": [
        0,
        0,
        "E"
      ],
      "gems": {
        "1,0": 4,
        "2,0": 2
      },
      "name": "short corridor",
      "goal": {
        "gems_exactly": {
          "2,0": 2
        }
      }
    },
    {
      "width": 5,
      "height": 1,
      "start": [
        0,
        0,
        "E"
      ],
      "name": "no gems",
      "goal": {
        "gems_exactly": {}
      }
    },
    {
      "width": 1,
      "height": 1,
      "start": [
        0,
        0,
        "E"
      ],
      "gems": {
        "0,0": 3
      },
      "name": "one cell",
      "goal": {
        "gems_exactly": {}
      }
    },
    {
      "width": 6,
      "height": 1,
      "start": [
        0,
        0,
        "E"
      ],
      "gems": {
        "1,0": 1,
        "2,0": 2,
        "4,0": 2,
        "5,0": 1
      },
      "name": "only small piles",
      "goal": {
        "gems_exactly": {
          "1,0": 1,
          "2,0": 2,
          "4,0": 2,
          "5,0": 1
        }
      }
    },
    {
      "width": 5,
      "height": 1,
      "start": [
        0,
        0,
        "E"
      ],
      "gems": {
        "0,0": 2,
        "1,0": 6,
        "3,0": 3,
        "4,0": 7
      },
      "name": "big pile at the end",
      "goal": {
        "gems_exactly": {
          "0,0": 2
        }
      }
    }
  ],
  "goal": {
    "no_error": true
  },
  "constraints": {
    "hidden_commands": [
      "scan"
    ],
    "required": [
      "compare"
    ]
  },
  "topics": [
    "comparison_operators.compare_numbers",
    "conditionals.if_statement",
    "while_loops.loop_until_condition"
  ]
}
