{
  "format": 1,
  "id": "turn_right",
  "title": "Make your own right turn",
  "brief": "The robot can only turn left. Three left turns face the same way as one right turn, so teach it turn_right() with def, then use it to reach the gem and pick it up.",
  "starter_code": "def turn_right():\n    # three left turns go here\n    pass\n\nmove()\nmove()\n",
  "world": {
    "width": 4,
    "height": 4,
    "start": [
      0,
      0,
      "E"
    ],
    "blocked": [
      [
        3,
        0
      ],
      [
        3,
        1
      ],
      [
        3,
        2
      ],
      [
        3,
        3
      ],
      [
        1,
        1
      ],
      [
        0,
        1
      ]
    ],
    "gems": {
      "0,2": 1
    }
  },
  "goal": {
    "all_gems_collected": true
  },
  "constraints": {
    "use_functions": [
      "turn_right"
    ]
  },
  "topics": [
    "functions.define_and_call",
    "decomposition.extract_repeated_code"
  ]
}
